{
  "issue_id": "issue-example-fio-reopen",
  "base_revision": 0,
  "title": "示例：文件重新打开失败",
  "type": "功能",
  "description": "示例数据，请替换为实际证据：测试进程创建文件后重新打开返回 EACCES。记录运行 ID、UID/GID、文件属主及错误日志；根因尚待确认。",
  "software": "Curvine / 请填写实际版本和镜像摘要",
  "hardware": "请填写云环境、机器型号、客户端 CPU/内存额度",
  "occurred_at": "2026-10-28T10:00:00+08:00",
  "resolved": false,
  "resolution": "",
  "reporter": "user:example",
  "change_note": ""
}
